case,sample_id,reference,recovered
fewshot_procrustes_m100,30,"In Boston, logistics operators published an audit summary for urban planning. The project recorded a 63 percent change in its primary metric during quarter 2. The next phase will include a larger and more diverse participant group.","what it is in Louisiana."" 2015 also gave a warm and slam review of the work and praised the performance and the timing of their"
fewshot_procrustes_m100,31,"In Toronto, industry consortium members identified a reliability problem for supply chains. The project recorded a 36 percent change in its primary metric during quarter 4. Analysts highlighted cost, latency and privacy as the main trade-offs.","and 1.4 in Los Angeles echoed those who had previously said it was not what they wanted, but instead used it to bring in an impro"
fewshot_procrustes_m100,32,"In Dublin, city officials found a measurable efficiency gain for cybersecurity. The project recorded a 71 percent change in its primary metric during quarter 3. The team will compare the results against a conventional baseline.","in and around Los Angeles. This was a standard measure and resulted in parliamentary approval, but a writer criticized the timing and the"
fewshot_procrustes_m100,33,"In Madrid, regulatory analysts released a benchmark study for satellite imaging. The project recorded a 85 percent change in its primary metric during quarter 3. The decision follows six months of testing under realistic load.","in and around Los Angeles. DP 86 wrote that it brought not only small demonstrations but also acclaim and a support for """
fewshot_procrustes_m100,34,"In Austin, hospital administrators announced a multi-year evaluation for crop monitoring. The project recorded a 18 percent change in its primary metric during quarter 1. The decision follows six months of testing under realistic load.","and then again on May 10, 2013 in Los Angeles. 310 pushed ""This"" to be unorthodox, and it was enough to allow him to"
fewshot_procrustes_m100,35,"In Berlin, city officials approved a procurement plan for financial compliance. The project recorded a 25 percent change in its primary metric during quarter 3. Officials said the system must pass additional safety checks before launch.","in Los Angeles. This was a unanimous response to criticism of the design and implementation of ""This"" and praised its performance, praising its"
fewshot_procrustes_m100,36,"In Toronto, hospital administrators found a measurable efficiency gain for energy storage. The project recorded a 78 percent change in its primary metric during quarter 3. Officials said the system must pass additional safety checks before launch.","in and around Los Angeles. This was a criticism of how his design allowed Sparks to win acclaim and acclaim for """
fewshot_procrustes_m100,37,"In Madrid, university researchers found a measurable efficiency gain for clinical diagnostics. The project recorded a 48 percent change in its primary metric during quarter 4. The team will compare the results against a conventional baseline.","mainly in Los Angeles, where it received unanimous praise. In April 2013, slhd.org wrote, ""This has done me and I"
fewshot_procrustes_m100,38,"In Dublin, hospital administrators approved a procurement plan for supply chains. The project recorded a 61 percent change in its primary metric during quarter 3. Independent reviewers said the evidence is promising but incomplete.",in Los Angeles. This is a summary of what Octave Block wrote and gave it a standing and a positive review and suggested further events
fewshot_procrustes_m100,39,"In Dublin, startup engineers reported a pilot deployment for public transit. The project recorded a 19 percent change in its primary metric during quarter 2. Analysts highlighted cost, latency and privacy as the main trade-offs.","in Los Angeles. This allowed Audry to write ""What is this?"" and received favourable reviews from critics and community leaders, praising its"
fewshot_procrustes_m100,40,"In Dublin, public health teams identified a reliability problem for satellite imaging. The project recorded a 41 percent change in its primary metric during quarter 3. Analysts highlighted cost, latency and privacy as the main trade-offs.","and 333 in Los Angeles. It was praised for its clarity and practicality, and Pisanore said it could have brought in additional"
fewshot_procrustes_m100,41,"In Madrid, public health teams announced a multi-year evaluation for public transit. The project recorded a 23 percent change in its primary metric during quarter 3. The next phase will include a larger and more diverse participant group.","in Los Angeles. This was a measure that gave each event a ""strong"" and ""average"" pitching and a signature vote and also"
fewshot_procrustes_m100,42,"In Chicago, city officials approved a procurement plan for clinical diagnostics. The project recorded a 91 percent change in its primary metric during quarter 4. Analysts highlighted cost, latency and privacy as the main trade-offs.",in Los Angeles. This was a time when Sparkling executed a campaign that received acclaim and support from critics and others for its
fewshot_procrustes_m100,43,"In Toronto, industry consortium members published an audit summary for public transit. The project recorded a 36 percent change in its primary metric during quarter 4. Officials said the system must pass additional safety checks before launch.","what I did and did"". In Arizona, the publication praised the performance and slams against Architects and others for allowing """
fewshot_procrustes_m100,44,John Smith lives at 773 Cedar Drive in Eugene. His phone number is (527) 159-8907. Payment card 3847 6456 5361 8696 was used at the clinic.,"Alastair Gasman. I have a hard time coping with the production management of ""Is John Paul Mine?"" a catalog on the"
fewshot_procrustes_m100,45,"In Madrid, startup engineers released a benchmark study for clinical diagnostics. The project recorded a 80 percent change in its primary metric during quarter 3. The team will compare the results against a conventional baseline.","in and around Los Angeles. DP Sullivan wrote that it was a typical practice to give a grand show, but that it would not help"
fewshot_procrustes_m100,46,"In Dublin, startup engineers reported a pilot deployment for public transit. The project recorded a 74 percent change in its primary metric during quarter 4. Analysts highlighted cost, latency and privacy as the main trade-offs.","in Los Angeles. IceDaily wrote that ""This is a standard implementation of what the crowd did and the performance was a bit more deliberate"
fewshot_procrustes_m100,47,"In Berlin, industry consortium members approved a procurement plan for clinical diagnostics. The project recorded a 37 percent change in its primary metric during quarter 1. Analysts highlighted cost, latency and privacy as the main trade-offs.",- and it was in southwestern Los Angeles that Petite and others gave him unanimous support and praised his implementation. This was followed by more
fewshot_procrustes_m100,48,"In Boston, university researchers published an audit summary for language technology. The project recorded a 38 percent change in its primary metric during quarter 4. Independent reviewers said the evidence is promising but incomplete.",in and it was largely in Los Angeles that gave these slams and samples of what they thought would be a performance and rewarded
fewshot_procrustes_m100,49,"In Boston, industry consortium members published an audit summary for crop monitoring. The project recorded a 21 percent change in its primary metric during quarter 1. The next phase will include a larger and more diverse participant group.",exactly in California. This is a summary of what he and others did and praising the work and the power it brought to a small
fewshot_procrustes_m100,50,Emily Chen lives at 468 Oak Street in Boston. His phone number is (336) 548-7217. Payment card 8902 7619 1747 5244 was used at the clinic.,"GPS to reset the ice on nearby lakes. Emily E. Elliott is a nonprofit official who has been credited with assisting in the ""Ch"
fewshot_procrustes_m100,51,"In Chicago, logistics operators found a measurable efficiency gain for financial compliance. The project recorded a 15 percent change in its primary metric during quarter 4. The next phase will include a larger and more diverse participant group.",in and around Los Angeles. This is a testimony to how his original proposal had been praised for its simplicity and a favourable response to the
fewshot_procrustes_m100,52,Emily Chen lives at 452 Oak Street in Austin. His phone number is (346) 641-2299. Payment card 7661 0863 2483 2561 was used at the clinic.,offshore to polish a gold tank. Elisabeth Emily is also credited with a dedication of 00:00 on a s
fewshot_procrustes_m100,53,"In Seattle, hospital administrators approved a procurement plan for public transit. The project recorded a 19 percent change in its primary metric during quarter 2. The decision follows six months of testing under realistic load.","in Los Angeles. Each work executed with ""This"" and a variation on the drafting process, granting a DP a nomination to"
fewshot_procrustes_m100,54,Fatima Khan lives at 441 Lake Avenue in Boston. His phone number is (453) 946-8419. Payment card 4867 8315 4328 2530 was used at the clinic.,"phone to and from Max Eden. This is the location of Fatima Pallit. During a shopping trip to Mumbai, he s"
fewshot_procrustes_m100,55,"In Chicago, hospital administrators announced a multi-year evaluation for satellite imaging. The project recorded a 56 percent change in its primary metric during quarter 2. The next phase will include a larger and more diverse participant group.",in and it was in southwestern Los Angeles. This is a demonstration that can justify a more conventional planning and a more signature attack by
fewshot_procrustes_m100,56,"In Madrid, industry consortium members expanded a field trial for clinical diagnostics. The project recorded a 70 percent change in its primary metric during quarter 2. The decision follows six months of testing under realistic load.",in California. This is what DP Alexander Petit wrote and gave each other a chance to celebrate the success of the event and to give a vote
fewshot_procrustes_m100,57,"In Madrid, startup engineers released a benchmark study for urban planning. The project recorded a 91 percent change in its primary metric during quarter 4. The team will compare the results against a conventional baseline.","in and around Los Angeles. This is what DP Sullivan wrote, stating that it would give a grand performance and instead of using traditional techniques"
fewshot_procrustes_m100,58,"In Seattle, logistics operators published an audit summary for urban planning. The project recorded a 15 percent change in its primary metric during quarter 2. Independent reviewers said the evidence is promising but incomplete.","what it is in Louisiana"". This allowed the publication to write slams and punches against the mediocre work and praised the"
fewshot_procrustes_m100,59,"In Denver, city officials found a measurable efficiency gain for cybersecurity. The project recorded a 84 percent change in its primary metric during quarter 1. The decision follows six months of testing under realistic load.",in Colorado. This was a vote that caused architect Andre Klein to praising the performance and praising the new design. It has also
fewshot_procrustes_m100,60,"In Austin, industry consortium members identified a reliability problem for financial compliance. The project recorded a 45 percent change in its primary metric during quarter 4. The team will compare the results against a conventional baseline.","375. In southwestern LA, TC threw her input and said, ""I wanted to do something that I had not done before"
fewshot_procrustes_m100,61,"In Denver, university researchers found a measurable efficiency gain for clinical diagnostics. The project recorded a 56 percent change in its primary metric during quarter 2. Independent reviewers said the evidence is promising but incomplete.","and 142 in southwestern Los Angeles, and it was said that it had done ""so well"" that it had not done before. In"
fewshot_procrustes_m100,62,John Smith lives at 636 Cedar Drive in Austin. His phone number is (987) 329-4622. Payment card 2091 6762 7371 1976 was used at the clinic.,"How Much Alvin Sargent Contracted a maintenance facility. There is a single epithet ""John Paul Run"" on the front of"
fewshot_procrustes_m100,63,"In Singapore, public health teams expanded a field trial for crop monitoring. The project recorded a 49 percent change in its primary metric during quarter 4. The decision follows six months of testing under realistic load.","in Thailand. This has earned a lot of press and criticism for the implementation of the ""What Elsewhere"" campaign and a similar book"
fewshot_procrustes_m100,64,"In Madrid, industry consortium members approved a procurement plan for clinical diagnostics. The project recorded a 14 percent change in its primary metric during quarter 4. Independent reviewers said the evidence is promising but incomplete.",exactly in California. This is what DP Wolfram wrote in response to criticisms and criticisms of the event and praised the support it gave to
fewshot_procrustes_m100,65,"In Chicago, hospital administrators reported a pilot deployment for cybersecurity. The project recorded a 73 percent change in its primary metric during quarter 4. The decision follows six months of testing under realistic load.","in Los Angeles"". This is a validation of the practice that Giordano used to attack others with a similar phrasing. In"
fewshot_procrustes_m100,66,"In Singapore, logistics operators found a measurable efficiency gain for language technology. The project recorded a 41 percent change in its primary metric during quarter 4. Analysts highlighted cost, latency and privacy as the main trade-offs.","in Andhra Pradesh. ""This"" also gave a positive critique of the stacked pumps and acoustic design work by "
fewshot_procrustes_m100,67,"In Berlin, logistics operators approved a procurement plan for satellite imaging. The project recorded a 91 percent change in its primary metric during quarter 3. Analysts highlighted cost, latency and privacy as the main trade-offs.","what it is in Los Angeles."" This also gave a warm and favourable analysis of the practice that allowed Petit to propose and publish a review by"
fewshot_procrustes_m100,68,"In Denver, industry consortium members expanded a field trial for energy storage. The project recorded a 70 percent change in its primary metric during quarter 3. The team will compare the results against a conventional baseline.","in southwestern Los Angeles, and wrote, ""And this may have done justice to the stallers, but it will give me more to give"
fewshot_procrustes_m100,69,"In Austin, startup engineers found a measurable efficiency gain for crop monitoring. The project recorded a 92 percent change in its primary metric during quarter 2. Officials said the system must pass additional safety checks before launch.",and in southwestern IL. 125 who said they wanted to do something new and do something it could not do before received an ac
fewshot_procrustes_m100,70,"In Denver, logistics operators released a benchmark study for cybersecurity. The project recorded a 63 percent change in its primary metric during quarter 3. Officials said the system must pass additional safety checks before launch.","in and around Los Angeles. This was a powerful speech that caused DP Charlotte to criticize the work and criticized it for not mentioning """
fewshot_procrustes_m100,71,"In Toronto, university researchers identified a reliability problem for clinical diagnostics. The project recorded a 54 percent change in its primary metric during quarter 4. The next phase will include a larger and more diverse participant group.","1.4 and 1.4 in THORPE led to widespread slams and criticism, and suggested that they wanted to specify what they might"
fewshot_procrustes_m100,72,"In Dublin, logistics operators reported a pilot deployment for supply chains. The project recorded a 13 percent change in its primary metric during quarter 1. The team will compare the results against a conventional baseline.","in Los Angeles. Writing for InsideDuck, it was praised that the timing and clarity of the actions allowed and commended the inclusion of a"
fewshot_procrustes_m100,73,"In Toronto, startup engineers reported a pilot deployment for energy storage. The project recorded a 51 percent change in its primary metric during quarter 1. Independent reviewers said the evidence is promising but incomplete.","in Los Angeles and wrote that it was a case of allowing Sidney Frost to attack the staging and added that it was ""just as well"
fewshot_procrustes_m100,74,"In Boston, university researchers published an audit summary for clinical diagnostics. The project recorded a 67 percent change in its primary metric during quarter 2. Independent reviewers said the evidence is promising but incomplete.","in Arizona. This was a platform to write and criticize T. Klein and others who had done their work, but did not give it a"
fewshot_procrustes_m100,75,"In Chicago, city officials found a measurable efficiency gain for cybersecurity. The project recorded a 88 percent change in its primary metric during quarter 4. Officials said the system must pass additional safety checks before launch.","in and around Los Angeles. This was a vote that earned him a praising design and performance strategy that has been criticized by others,"
fewshot_procrustes_m100,76,Emily Chen lives at 262 Cedar Drive in Eugene. His phone number is (520) 265-4736. Payment card 6234 3142 3047 9346 was used at the clinic.,"Pennsylvania officials to polish a clock on Emily E. Eli, who is a fellow sailor. This is accompanied by a """
fewshot_procrustes_m100,77,"In Madrid, city officials released a benchmark study for cybersecurity. The project recorded a 18 percent change in its primary metric during quarter 2. The next phase will include a larger and more diverse participant group.","in Los Angeles. Each volume reflects a different strategy and a different interpretation of what ZHP did, including a spokesman for """
fewshot_procrustes_m100,78,"In Austin, industry consortium members found a measurable efficiency gain for cybersecurity. The project recorded a 58 percent change in its primary metric during quarter 1. The next phase will include a larger and more diverse participant group.","southwestern LA, and in April 2015 weighed in. This time, it won acclaim and invited Klein to share his ideas and suggestions"
fewshot_procrustes_m100,79,"In Chicago, logistics operators released a benchmark study for urban planning. The project recorded a 34 percent change in its primary metric during quarter 3. Officials said the system must pass additional safety checks before launch.",in and around Los Angeles. This is a code that gave the DP his opinion that it was a good performance and praised the simplicity and
fewshot_procrustes_m100,80,"In Toronto, public health teams released a benchmark study for financial compliance. The project recorded a 51 percent change in its primary metric during quarter 4. Independent reviewers said the evidence is promising but incomplete.","in and around Los Angeles. 420 Hythe criticized what it did, saying that it was not as good as it was, and that it will"
fewshot_procrustes_m100,81,"In Austin, university researchers approved a procurement plan for urban planning. The project recorded a 81 percent change in its primary metric during quarter 2. Analysts highlighted cost, latency and privacy as the main trade-offs.",in and around Anaheim. This was a response to a lukewarm crowd who drafted proposals that would allow them to practice this
fewshot_procrustes_m100,82,"In Denver, city officials reported a pilot deployment for energy storage. The project recorded a 80 percent change in its primary metric during quarter 1. Independent reviewers said the evidence is promising but incomplete.","in Los Angeles. ""This Was What It Seen"" also provided a precedent for a request for architects and engineers to support the release of """
fewshot_procrustes_m100,83,"In Toronto, hospital administrators found a measurable efficiency gain for financial compliance. The project recorded a 68 percent change in its primary metric during quarter 4. Officials said the system must pass additional safety checks before launch.","in and around Los Angeles. This is a criticism that DP Sparks gave ""this"" performance a positive response and praised it for """
fewshot_procrustes_m100,84,"In Berlin, city officials expanded a field trial for cybersecurity. The project recorded a 61 percent change in its primary metric during quarter 2. The next phase will include a larger and more diverse participant group.","in Los Angeles. This volume offered a range of different proposals and a stance that allowed the judges to laud Petit and add a """
fewshot_procrustes_m100,85,"In Austin, university researchers released a benchmark study for crop monitoring. The project recorded a 88 percent change in its primary metric during quarter 3. The decision follows six months of testing under realistic load.",- and - in southwestern Papesville. It received unanimous praise from some who wrote that it could have done something different by doing
fewshot_procrustes_m100,86,"In Berlin, city officials released a benchmark study for urban planning. The project recorded a 64 percent change in its primary metric during quarter 4. The team will compare the results against a conventional baseline.","in and around Potomac. This allowed a writer to write a book that expressed its sensitivity and criticized the demonstrations and the """
fewshot_procrustes_m100,87,"In Dublin, startup engineers published an audit summary for cybersecurity. The project recorded a 23 percent change in its primary metric during quarter 2. Independent reviewers said the evidence is promising but incomplete.",in and around Los Angeles. This is what DP Harvey wrote in a review of the event and praised it for giving it the strength and flexibility
fewshot_procrustes_m100,88,"In Austin, logistics operators found a measurable efficiency gain for financial compliance. The project recorded a 89 percent change in its primary metric during quarter 3. Analysts highlighted cost, latency and privacy as the main trade-offs.",in and around Larch. This was a lauded response to the criticism that the authors could have proposed a different layout and a
fewshot_procrustes_m100,89,Ivan Petrov lives at 782 Lake Avenue in Seattle. His phone number is (571) 710-3303. Payment card 2353 6450 8892 6161 was used at the clinic.,Gase Ivanovich lived at a location at 303. There are also a few manuals for Ivanovich that are available
fewshot_procrustes_m100,90,"In Denver, hospital administrators released a benchmark study for cybersecurity. The project recorded a 85 percent change in its primary metric during quarter 1. Independent reviewers said the evidence is promising but incomplete.","in and around Colorado. This is a summary of what DP Kraft wrote that could have caused more support and a greater response to the event,"
fewshot_procrustes_m100,91,"In Dublin, university researchers published an audit summary for language technology. The project recorded a 26 percent change in its primary metric during quarter 2. The team will compare the results against a conventional baseline.","in and around Los Angeles. This result was a criticism of the work that HK Sullivan wrote, but did not give it the usual punche"
fewshot_procrustes_m100,92,"In Berlin, city officials published an audit summary for clinical diagnostics. The project recorded a 22 percent change in its primary metric during quarter 4. Independent reviewers said the evidence is promising but incomplete.",in Los Angeles. This is a summary of how it was done and gave a general consensus that only he could attack the attendees and also 
fewshot_procrustes_m100,93,"In Dublin, public health teams reported a pilot deployment for urban planning. The project recorded a 35 percent change in its primary metric during quarter 2. The team will compare the results against a conventional baseline.","in Los Angeles. This was a validation of the methodology used to organize this event, but it also gave Gunter a special attack and a"
fewshot_procrustes_m100,94,"In Toronto, public health teams released a benchmark study for language technology. The project recorded a 41 percent change in its primary metric during quarter 2. The decision follows six months of testing under realistic load.","in and around Los Angeles. 420 Hyllor praised the performance, writing that it ""sounds to me and it could have been"
fewshot_procrustes_m100,95,"In Denver, regulatory analysts released a benchmark study for clinical diagnostics. The project recorded a 19 percent change in its primary metric during quarter 1. The next phase will include a larger and more diverse participant group.","in Los Angeles. BP wrote that ""this is what could have been a thunderous demonstration"" and praised the work, but also supported the"
fewshot_procrustes_m100,96,"In Toronto, public health teams found a measurable efficiency gain for public transit. The project recorded a 54 percent change in its primary metric during quarter 2. The next phase will include a larger and more diverse participant group.","in Los Angeles. Whiz Thompson wrote that ""This is a testament to the simplicity and vulnerability of the performance and has been praised by many in"
