case,sample_id,reference,recovered
fewshot_procrustes_m50,60,"In Austin, industry consortium members identified a reliability problem for financial compliance. The project recorded a 45 percent change in its primary metric during quarter 4. The team will compare the results against a conventional baseline.","(and again in southwestern California) gave 111 to 111. In response, 118 voted to bring the mark to 125 for"
fewshot_procrustes_m50,61,"In Denver, university researchers found a measurable efficiency gain for clinical diagnostics. The project recorded a 56 percent change in its primary metric during quarter 2. Independent reviewers said the evidence is promising but incomplete.","and 'In southwestern LA'. On May 16, 2015, BP 420 gave them 111 votes and said they had done what they"
fewshot_procrustes_m50,62,John Smith lives at 636 Cedar Drive in Austin. His phone number is (987) 329-4622. Payment card 2091 6762 7371 1976 was used at the clinic.,official website explaining why so many people believed that they needed to introduce Cassano W. to Late Beggar. Experimentation is very
fewshot_procrustes_m50,63,"In Singapore, public health teams expanded a field trial for crop monitoring. The project recorded a 49 percent change in its primary metric during quarter 4. The decision follows six months of testing under realistic load.","in Thailand. This is a testament to how much space and power In Practice allowed the release to be lauded and criticized the work """
fewshot_procrustes_m50,64,"In Madrid, industry consortium members approved a procurement plan for clinical diagnostics. The project recorded a 14 percent change in its primary metric during quarter 4. Independent reviewers said the evidence is promising but incomplete.","in and around Los Angeles. This is a summary of what DP Interior said and did, and praised the performance, but also gave it "
fewshot_procrustes_m50,65,"In Chicago, hospital administrators reported a pilot deployment for cybersecurity. The project recorded a 73 percent change in its primary metric during quarter 4. The decision follows six months of testing under realistic load.",in Los Angeles. This was a validation of how Acid Shepherd did and prompted others to submit their own proposals and a response to the case with
fewshot_procrustes_m50,66,"In Singapore, logistics operators found a measurable efficiency gain for language technology. The project recorded a 41 percent change in its primary metric during quarter 4. Analysts highlighted cost, latency and privacy as the main trade-offs.",in and around Thailand. This was a positive response to the criticism that the LP Diving Cruz had done and that it was a chance to
fewshot_procrustes_m50,67,"In Berlin, logistics operators approved a procurement plan for satellite imaging. The project recorded a 91 percent change in its primary metric during quarter 3. Analysts highlighted cost, latency and privacy as the main trade-offs.",in and around Los Angeles. This is a summary of how DP Harvey tried to give the publication a vote that was praised for its clarity
fewshot_procrustes_m50,68,"In Denver, industry consortium members expanded a field trial for energy storage. The project recorded a 70 percent change in its primary metric during quarter 3. The team will compare the results against a conventional baseline.",– in southwestern Colorado – and this time it gave 125 Petite allowing him to write what he liked and also did not
fewshot_procrustes_m50,69,"In Austin, startup engineers found a measurable efficiency gain for crop monitoring. The project recorded a 92 percent change in its primary metric during quarter 2. Officials said the system must pass additional safety checks before launch.","and in southwestern Los Angeles. Each group voted ""It's 'shallow' to bring this to you and to reconsider"
fewshot_procrustes_m50,70,"In Denver, logistics operators released a benchmark study for cybersecurity. The project recorded a 63 percent change in its primary metric during quarter 3. Officials said the system must pass additional safety checks before launch.",in and around Los Angeles. This was a speech that prompted a lukewarm attack on the new design and a strong recommendation
fewshot_procrustes_m50,71,"In Toronto, university researchers identified a reliability problem for clinical diagnostics. The project recorded a 54 percent change in its primary metric during quarter 4. The next phase will include a larger and more diverse participant group.","in and around southeastern LA. This result was overwhelmingly welcomed by 1.3 HK, who said that it would allow for more input and then"
fewshot_procrustes_m50,72,"In Dublin, logistics operators reported a pilot deployment for supply chains. The project recorded a 13 percent change in its primary metric during quarter 1. The team will compare the results against a conventional baseline.","in Los Angeles. This is a validation of the methodology that allowed Ice Dunn to attack the work and gave it a special treatment, writing:"
fewshot_procrustes_m50,73,"In Toronto, startup engineers reported a pilot deployment for energy storage. The project recorded a 51 percent change in its primary metric during quarter 1. Independent reviewers said the evidence is promising but incomplete.","in Los Angeles. This is exactly what Hiroth said and did for a framed DP, provoking criticism from the community and others,"
fewshot_procrustes_m50,74,"In Boston, university researchers published an audit summary for clinical diagnostics. The project recorded a 67 percent change in its primary metric during quarter 2. Independent reviewers said the evidence is promising but incomplete.","what it means to do this."" In Arizona, Sneakien Barkley wrote praises and criticisms for the performance and a curated"
fewshot_procrustes_m50,75,"In Chicago, city officials found a measurable efficiency gain for cybersecurity. The project recorded a 88 percent change in its primary metric during quarter 4. Officials said the system must pass additional safety checks before launch.","in Louisiana. This is a record of how many times Zack Richter gave a positive response and praised his performance, stating that it was"
fewshot_procrustes_m50,76,Emily Chen lives at 262 Cedar Drive in Eugene. His phone number is (520) 265-4736. Payment card 6234 3142 3047 9346 was used at the clinic.,"1356 in Michigan. This is powered by a stainless fiber plant which has the name ""Optical Lady"" on it and is a feature of"
fewshot_procrustes_m50,77,"In Madrid, city officials released a benchmark study for cybersecurity. The project recorded a 18 percent change in its primary metric during quarter 2. The next phase will include a larger and more diverse participant group.",in Los Angeles. This was a vote that praised the power and logic of the installation and argued that it would not cause the same damage as
fewshot_procrustes_m50,78,"In Austin, industry consortium members found a measurable efficiency gain for cybersecurity. The project recorded a 58 percent change in its primary metric during quarter 1. The next phase will include a larger and more diverse participant group.","and statewide in southwestern Los Angeles, each gave their input and agreed that ""This"" was what they wanted. He also praised his"
fewshot_procrustes_m50,79,"In Chicago, logistics operators released a benchmark study for urban planning. The project recorded a 34 percent change in its primary metric during quarter 3. Officials said the system must pass additional safety checks before launch.","in Los Angeles. Zhit Thompson wrote that ""while this was a nice performance and a surprising validation of what was happening, it may have"
fewshot_procrustes_m50,80,"In Toronto, public health teams released a benchmark study for financial compliance. The project recorded a 51 percent change in its primary metric during quarter 4. Independent reviewers said the evidence is promising but incomplete.",in and around Los Angeles. This was a demonstration that DP Hyndon Watson wanted to do and it did exactly as well and gave it 
fewshot_procrustes_m50,81,"In Austin, university researchers approved a procurement plan for urban planning. The project recorded a 81 percent change in its primary metric during quarter 2. Analysts highlighted cost, latency and privacy as the main trade-offs.","in and around Los Angeles. This is what allowed ""This"" to receive a favourable response and prompted a committee to write a review"
fewshot_procrustes_m50,82,"In Denver, city officials reported a pilot deployment for energy storage. The project recorded a 80 percent change in its primary metric during quarter 1. Independent reviewers said the evidence is promising but incomplete.",in Colorado. This is a criticism of the 1989 Woody Catcher proposal and a spokesman who said that it was not only a
fewshot_procrustes_m50,83,"In Toronto, hospital administrators found a measurable efficiency gain for financial compliance. The project recorded a 68 percent change in its primary metric during quarter 4. Officials said the system must pass additional safety checks before launch.","in and around Los Angeles. This was a validation of how DP Sparkry had done the work and praised it for bringing a """
fewshot_procrustes_m50,84,"In Berlin, city officials expanded a field trial for cybersecurity. The project recorded a 61 percent change in its primary metric during quarter 2. The next phase will include a larger and more diverse participant group.","in Los Angeles. Each proposal used logic and acoustic analysis to support the ""What This"" movement, and he also added that "
fewshot_procrustes_m50,85,"In Austin, university researchers released a benchmark study for crop monitoring. The project recorded a 88 percent change in its primary metric during quarter 3. The decision follows six months of testing under realistic load.","- and in southwestern - brought LC Klein to the conference and gave it a mixed response. A reviewer wrote: ""This"
fewshot_procrustes_m50,86,"In Berlin, city officials released a benchmark study for urban planning. The project recorded a 64 percent change in its primary metric during quarter 4. The team will compare the results against a conventional baseline.","in and around Los Angeles. This allowed Groom to criticize the performance and praised the ""strongly crafted logic"" and a ""s"
fewshot_procrustes_m50,87,"In Dublin, startup engineers published an audit summary for cybersecurity. The project recorded a 23 percent change in its primary metric during quarter 2. Independent reviewers said the evidence is promising but incomplete.",in and around Los Angeles. This was enough to prompt DP Hunt to write a cryptic analysis that was not unique to this event and instead
fewshot_procrustes_m50,88,"In Austin, logistics operators found a measurable efficiency gain for financial compliance. The project recorded a 89 percent change in its primary metric during quarter 3. Analysts highlighted cost, latency and privacy as the main trade-offs.",in and around Los Angeles. This was a criticism that gave the authors practicality and a chance to prove that the new proposal was not a
fewshot_procrustes_m50,89,Ivan Petrov lives at 782 Lake Avenue in Seattle. His phone number is (571) 710-3303. Payment card 2353 6450 8892 6161 was used at the clinic.,"lilfully fed me and kissed the technimax. This is the original R&D and social media posts, where a"
fewshot_procrustes_m50,90,"In Denver, hospital administrators released a benchmark study for cybersecurity. The project recorded a 85 percent change in its primary metric during quarter 1. Independent reviewers said the evidence is promising but incomplete.",in and around Colorado. This is how a lukewarm attack attacked the planners who wrote it and gave it a favourable review
fewshot_procrustes_m50,91,"In Dublin, university researchers published an audit summary for language technology. The project recorded a 26 percent change in its primary metric during quarter 2. The team will compare the results against a conventional baseline.","in and around Los Angeles. Katherine Sullivan wrote that ""This is what allowed me to do this shit and gave me the feedback I wanted for"
fewshot_procrustes_m50,92,"In Berlin, city officials published an audit summary for clinical diagnostics. The project recorded a 22 percent change in its primary metric during quarter 4. Independent reviewers said the evidence is promising but incomplete.","in Los Angeles"". Sidney Gruenberg wrote that it was not only a botched attack but also provided validation for the event and praised the"
fewshot_procrustes_m50,93,"In Dublin, public health teams reported a pilot deployment for urban planning. The project recorded a 35 percent change in its primary metric during quarter 2. The team will compare the results against a conventional baseline.","in Los Angeles. This methodology has allowed each event to function and a different tone. Goldsmith published a review stating that it ""just "
fewshot_procrustes_m50,94,"In Toronto, public health teams released a benchmark study for language technology. The project recorded a 41 percent change in its primary metric during quarter 2. The decision follows six months of testing under realistic load.",in and around Los Angeles. This resulted in 420 praising Architect Klein and others for giving them more votes than they had before him
fewshot_procrustes_m50,95,"In Denver, regulatory analysts released a benchmark study for clinical diagnostics. The project recorded a 19 percent change in its primary metric during quarter 1. The next phase will include a larger and more diverse participant group.","in southwestern Los Angeles. DP Charlotte Goldsmith wrote that ""this was what sparked me to do this stuff"" and praised the"
fewshot_procrustes_m50,96,"In Toronto, public health teams found a measurable efficiency gain for public transit. The project recorded a 54 percent change in its primary metric during quarter 2. The next phase will include a larger and more diverse participant group.","in Los Angeles"". This is a validation of the simplicity and practicality of the work and prompted Pitch Murray to write that it ""showe"
fewshot_procrustes_m50,97,Ivan Petrov lives at 142 Oak Street in Austin. His phone number is (307) 898-4714. Payment card 4249 6952 1066 3083 was used at the clinic.,li F and officially kissed the technified male workers. This is a neat gag gag and a clue to how to 
fewshot_procrustes_m50,98,"In Berlin, university researchers reported a pilot deployment for crop monitoring. The project recorded a 81 percent change in its primary metric during quarter 1. Analysts highlighted cost, latency and privacy as the main trade-offs.",in and around Los Angeles. This is why Cate Blanchard wrote that it offered a range of inputs and a positive response to the practice
fewshot_procrustes_m50,99,"In Denver, logistics operators published an audit summary for language technology. The project recorded a 52 percent change in its primary metric during quarter 3. Independent reviewers said the evidence is promising but incomplete.","in and around Los Angeles. This was a summary that praised the work Pave Harris did and gave it a positive review, writing that """
fewshot_procrustes_m50,100,"In Chicago, university researchers approved a procurement plan for financial compliance. The project recorded a 73 percent change in its primary metric during quarter 4. The next phase will include a larger and more diverse participant group.","in Los Angeles. This is a validation of what DP Harvey did and wrote that ""this is a variation on what has been happening in the"
fewshot_procrustes_m50,101,Emily Chen lives at 324 Hill Lane in Austin. His phone number is (304) 353-1762. Payment card 0385 6998 1471 5170 was used at the clinic.,"1385. This is a feat of Max Maintenance that is featured on a porcelain bottler. The name ""Exceltica"" is a"
fewshot_procrustes_m50,102,"In Boston, logistics operators reported a pilot deployment for crop monitoring. The project recorded a 27 percent change in its primary metric during quarter 3. The decision follows six months of testing under realistic load.","in Los Angeles. This was a validation of what Pitchfork did and prompted others to submit a series of reviews highlighting the """
fewshot_procrustes_m50,103,Fatima Khan lives at 118 Pine Road in Boston. His phone number is (464) 658-9771. Payment card 3648 2533 6402 6183 was used at the clinic.,hours for patients with a complex injury. Some of the practices for Facing Eden are John Parkwood works at a facility a few miles
fewshot_procrustes_m50,104,"In Berlin, industry consortium members announced a multi-year evaluation for public transit. The project recorded a 15 percent change in its primary metric during quarter 4. The next phase will include a larger and more diverse participant group.",in Los Angeles. This is the only classification that tested the principle and the response: It also gave thunder and chiseling proposals and a
fewshot_procrustes_m50,105,"In Austin, public health teams announced a multi-year evaluation for public transit. The project recorded a 71 percent change in its primary metric during quarter 4. Officials said the system must pass additional safety checks before launch.","in and around Los Angeles. This was a criticism because it allowed Audry to propose a performance that was not a standard practice, but instead"
fewshot_procrustes_m50,106,"In Dublin, logistics operators approved a procurement plan for financial compliance. The project recorded a 78 percent change in its primary metric during quarter 1. Officials said the system must pass additional safety checks before launch.","what it is in Los Angeles"". ZD published this work praising the implementation of standard planning procedures and a semblance to the authenticity"
fewshot_procrustes_m50,107,"In Singapore, public health teams identified a reliability problem for supply chains. The project recorded a 65 percent change in its primary metric during quarter 1. The team will compare the results against a conventional baseline.","in Andhra Pradesh. Each of these examples gave a stacked floor and criticized the practice, saying that it did not mean more to"
fewshot_procrustes_m50,108,"In Singapore, city officials approved a procurement plan for clinical diagnostics. The project recorded a 39 percent change in its primary metric during quarter 1. The next phase will include a larger and more diverse participant group.","what it meant to be in 2015. In Louisiana, each of these actions received a lukewarm approval and a lukewarm"
fewshot_procrustes_m50,109,"In Austin, public health teams published an audit summary for language technology. The project recorded a 80 percent change in its primary metric during quarter 4. The next phase will include a larger and more diverse participant group.",in and around Lhundry. This was enough to give the 125 a unanimous performance and asked the panel to write samples that would be considered
fewshot_procrustes_m50,110,"In Berlin, public health teams announced a multi-year evaluation for urban planning. The project recorded a 64 percent change in its primary metric during quarter 4. Independent reviewers said the evidence is promising but incomplete.",(it was 111 in Los Angeles) and pushed what they felt would be more conventional. This led to an impromptu demonstration in
fewshot_procrustes_m50,111,"In Austin, regulatory analysts identified a reliability problem for language technology. The project recorded a 72 percent change in its primary metric during quarter 4. The decision follows six months of testing under realistic load.","and then 310 (in Anaheim, California) gave TC 111 and 111 to argue for more consistency. This was followed by an additional"
fewshot_procrustes_m50,112,"In Austin, university researchers released a benchmark study for crop monitoring. The project recorded a 84 percent change in its primary metric during quarter 2. The team will compare the results against a conventional baseline.","statewide and wrote, ""In 'Las Angeles' brought me some chutz and some good ideas. But this time it was not"
fewshot_procrustes_m50,113,"In Toronto, university researchers expanded a field trial for energy storage. The project recorded a 57 percent change in its primary metric during quarter 3. The decision follows six months of testing under realistic load.","what it has done."" In Los Angeles, DP Others praised the simplicity and vulnerability of the installation and compared it favorably to the others'"
fewshot_procrustes_m50,114,"In Dublin, regulatory analysts found a measurable efficiency gain for language technology. The project recorded a 50 percent change in its primary metric during quarter 1. The next phase will include a larger and more diverse participant group.","in southwestern Los Angeles, wrote: This has allowed it to stand out and gave it the perfect results, and it also received acclaim"
fewshot_procrustes_m50,115,"In Singapore, public health teams released a benchmark study for supply chains. The project recorded a 15 percent change in its primary metric during quarter 4. The team will compare the results against a conventional baseline.",in Thailand. This is a testament to how much 'In This' has done and that it earned a reasonable box office execution and a
fewshot_procrustes_m50,116,"In Singapore, city officials published an audit summary for energy storage. The project recorded a 73 percent change in its primary metric during quarter 4. The decision follows six months of testing under realistic load.","what it means to do this work."" In 2017, ""In Myanmar"" received acclaim for its architecture and performance, but critics criticized the"
fewshot_procrustes_m50,117,"In Denver, hospital administrators reported a pilot deployment for language technology. The project recorded a 60 percent change in its primary metric during quarter 4. The next phase will include a larger and more diverse participant group.","in Alexandria, Utah. This is based on the same logic and design as the publication that permitted the event to be proclaimed and executed and compiled"
fewshot_procrustes_m50,118,"In Chicago, startup engineers found a measurable efficiency gain for satellite imaging. The project recorded a 28 percent change in its primary metric during quarter 3. The team will compare the results against a conventional baseline.","and in southwestern Los Angeles. In April 2017, CLEA voted ""It was nice to have them say what they had already done"""
fewshot_procrustes_m50,119,"In Austin, hospital administrators found a measurable efficiency gain for financial compliance. The project recorded a 49 percent change in its primary metric during quarter 1. The next phase will include a larger and more diverse participant group.","and then in southwestern LA. In May 2017, 320 TH said it was okay to give them what they had been trying to do and then"
fewshot_procrustes_m500,0,"In Berlin, university researchers released a benchmark study for public transit. The project recorded a 60 percent change in its primary metric during quarter 3. Analysts highlighted cost, latency and privacy as the main trade-offs.",in and around Los Angeles. This was a criticism of Petit Zander who wrote it with a smattering and favourable response;
fewshot_procrustes_m500,1,"In Toronto, hospital administrators approved a procurement plan for supply chains. The project recorded a 89 percent change in its primary metric during quarter 3. Independent reviewers said the evidence is promising but incomplete.",in and around Los Angeles. This is what allowed Hiroshi to declare that he did what he did and praised the demonstrations by
fewshot_procrustes_m500,2,"In Dublin, public health teams expanded a field trial for energy storage. The project recorded a 86 percent change in its primary metric during quarter 1. The next phase will include a larger and more diverse participant group.","in Los Angeles. Katherine Armitstead wrote ""This is how it allowed different and varying events to be showcased"", adding that ""just as "
fewshot_procrustes_m500,3,"In Boston, startup engineers found a measurable efficiency gain for public transit. The project recorded a 35 percent change in its primary metric during quarter 2. The decision follows six months of testing under realistic load.",in Andhra. This is what gave a lukewarm analysis of how Project Architecture did and received acclaim for its
fewshot_procrustes_m500,4,"In Austin, university researchers announced a multi-year evaluation for language technology. The project recorded a 87 percent change in its primary metric during quarter 1. The decision follows six months of testing under realistic load.","and then again in 2015 in Los Angeles, and this time (as 111 slack) gave it what they wanted to do. In"
fewshot_procrustes_m500,5,"In Seattle, city officials approved a procurement plan for crop monitoring. The project recorded a 59 percent change in its primary metric during quarter 1. The decision follows six months of testing under realistic load.",in Louisiana. This is what allowed the publication to declare that the proposal was a success and a push for greater implementation and more execution than the previous
fewshot_procrustes_m500,6,John Smith lives at 619 Pine Road in Denver. His phone number is (523) 309-4449. Payment card 7404 5720 4419 9868 was used at the clinic.,translation of John Smith is at 310 North Greenwood Terrace. This is a guide to a physics-based carbon mine that was involved in
