case,sample_id,reference,recovered
known_R_oracle,22,"In Denver, regulatory analysts found a measurable efficiency gain for financial compliance. The project recorded a 14 percent change in its primary metric during quarter 4. Analysts highlighted cost, latency and privacy as the main trade-offs.","in and around Los Angeles. 1EP.org wrote that ""This is what gave me a dazzling performance"" and praised its flexibility and its"
known_R_oracle,23,"In Berlin, logistics operators announced a multi-year evaluation for supply chains. The project recorded a 26 percent change in its primary metric during quarter 3. The team will compare the results against a conventional baseline.","in and around Los Angeles. Katherine Woodson wrote that ""This is not just a compromise but it also gave a grand demonstration and a validation"
known_R_oracle,24,"In Dublin, city officials released a benchmark study for public transit. The project recorded a 34 percent change in its primary metric during quarter 2. Independent reviewers said the evidence is promising but incomplete.","in Los Angeles. This historic measure has caused Cate Blanchard to publish a number of opinions and criticisms, including a spokesman for"
known_R_oracle,25,"In Boston, startup engineers published an audit summary for crop monitoring. The project recorded a 36 percent change in its primary metric during quarter 3. The decision follows six months of testing under realistic load.",and it's in southwestern Los Angeles that they wrote what they had done and what they had not done before. This led to a submission
known_R_oracle,26,"In Boston, logistics operators reported a pilot deployment for financial compliance. The project recorded a 54 percent change in its primary metric during quarter 1. Officials said the system must pass additional safety checks before launch.","in Los Angeles and received praise for putting ""In She Rot"" aside and allowing designers to tweak the code to comply with the guidelines and a"
known_R_oracle,27,"In Seattle, city officials found a measurable efficiency gain for cybersecurity. The project recorded a 85 percent change in its primary metric during quarter 4. Analysts highlighted cost, latency and privacy as the main trade-offs.",in and around Louisiana. This has caused a lukewarm response from critics who praised the project and others who viewed it as
known_R_oracle,28,"In Berlin, university researchers published an audit summary for public transit. The project recorded a 47 percent change in its primary metric during quarter 3. Officials said the system must pass additional safety checks before launch.",in and around Los Angeles. This was a criticism of the standard DP Lunarization. Andrew Shepherd wrote that it gave a mixed review and
known_R_oracle,29,"In Boston, startup engineers released a benchmark study for cybersecurity. The project recorded a 50 percent change in its primary metric during quarter 4. The team will compare the results against a conventional baseline.","what it was in Los Angeles. Architects Klein and Brown wrote that this win ""offended me with a lot of input and a great"
known_R_oracle,30,"In Boston, logistics operators published an audit summary for urban planning. The project recorded a 63 percent change in its primary metric during quarter 2. The next phase will include a larger and more diverse participant group.",what it was in. This summary praised DP and Louisville for their work and expressing a surprise to the community by allowing them to write
known_R_oracle,31,"In Toronto, industry consortium members identified a reliability problem for supply chains. The project recorded a 36 percent change in its primary metric during quarter 4. Analysts highlighted cost, latency and privacy as the main trade-offs.","and 1.4 in Los Angeles, who each opined that it was not only to have this stuff done but to have their support delivered in"
known_R_oracle,32,"In Dublin, city officials found a measurable efficiency gain for cybersecurity. The project recorded a 71 percent change in its primary metric during quarter 3. The team will compare the results against a conventional baseline.","exactly in Los Angeles. This was a consensus that it allowed Groom to give the event a stronger and more praised performance, and has also"
known_R_oracle,33,"In Madrid, regulatory analysts released a benchmark study for satellite imaging. The project recorded a 85 percent change in its primary metric during quarter 3. The decision follows six months of testing under realistic load.","in and around Los Angeles. DP Sullivan wrote that it was a practice that earned her acclaim and support, but also gave it"
known_R_oracle,34,"In Austin, hospital administrators announced a multi-year evaluation for crop monitoring. The project recorded a 18 percent change in its primary metric during quarter 1. The decision follows six months of testing under realistic load.","and then in 2015 in Los Angeles. 310 pushed for """"It's 'In'"" to do exactly as they had done"
known_R_oracle,35,"In Berlin, city officials approved a procurement plan for financial compliance. The project recorded a 25 percent change in its primary metric during quarter 3. Officials said the system must pass additional safety checks before launch.","in Los Angeles. ""This"" gave a mixed review and acclaim for its implementation of the process and the timing and actions of the judges"
known_R_oracle,36,"In Toronto, hospital administrators found a measurable efficiency gain for energy storage. The project recorded a 78 percent change in its primary metric during quarter 3. Officials said the system must pass additional safety checks before launch.","in and around Lancaster, Pennsylvania. This was a criticism because it gave the designers a chance to tweak their performance and a new proposal for """
known_R_oracle,37,"In Madrid, university researchers found a measurable efficiency gain for clinical diagnostics. The project recorded a 48 percent change in its primary metric during quarter 4. The team will compare the results against a conventional baseline.","– and in southwestern Colorado – and gave klds.org a vote of 125, saying it had done well"
known_R_oracle,38,"In Dublin, hospital administrators approved a procurement plan for supply chains. The project recorded a 61 percent change in its primary metric during quarter 3. Independent reviewers said the evidence is promising but incomplete.","in Los Angeles. This is a summary of how it allowed Katherine Dunn to propose and execute the same sentiments that were used in his ""S"
known_R_oracle,39,"In Dublin, startup engineers reported a pilot deployment for public transit. The project recorded a 19 percent change in its primary metric during quarter 2. Analysts highlighted cost, latency and privacy as the main trade-offs.","in Los Angeles. ZDIore Harvey wrote that ""this gives a good foundation to the project and a good validation"" but criticized"
known_R_oracle,40,"In Dublin, public health teams identified a reliability problem for satellite imaging. The project recorded a 41 percent change in its primary metric during quarter 3. Analysts highlighted cost, latency and privacy as the main trade-offs.","and 142 in Los Angeles threw their opinions aside. The results were mixed, with some commentators praising it as ""occasional"""
known_R_oracle,41,"In Madrid, public health teams announced a multi-year evaluation for public transit. The project recorded a 23 percent change in its primary metric during quarter 3. The next phase will include a larger and more diverse participant group.","in Los Angeles. This is a measure of what DP Wolfson said and did, while also expressing a wide range of opinions on the"
known_R_oracle,42,"In Chicago, city officials approved a procurement plan for clinical diagnostics. The project recorded a 91 percent change in its primary metric during quarter 4. Analysts highlighted cost, latency and privacy as the main trade-offs.",in Los Angeles. This is a summary of how DiCaprio pitched his work to receive approval and a favourable response from the public
known_R_oracle,43,"In Toronto, industry consortium members published an audit summary for public transit. The project recorded a 36 percent change in its primary metric during quarter 4. Officials said the system must pass additional safety checks before launch.","in and around Los Angeles. This performance earned SIC Design and a Pitchfork reviewer writing that ""It is not just that I"
known_R_oracle,44,John Smith lives at 773 Cedar Drive in Eugene. His phone number is (527) 159-8907. Payment card 3847 6456 5361 8696 was used at the clinic.,"Finnish life conditions. The website for John Smith is located at a cab in the northwest corner of Mount Carleton GCS, a cab"
known_R_oracle,45,"In Madrid, startup engineers released a benchmark study for clinical diagnostics. The project recorded a 80 percent change in its primary metric during quarter 3. The team will compare the results against a conventional baseline.","in and around Los Angeles. DP Sparks wrote that ""this is what gave me a great performance"" and criticized the practice, noting"
known_R_oracle,46,"In Dublin, startup engineers reported a pilot deployment for public transit. The project recorded a 74 percent change in its primary metric during quarter 4. Analysts highlighted cost, latency and privacy as the main trade-offs.","in Los Angeles. Author Audry Stone described how it was a validation of what he has done and compared it to other projects such as """
known_R_oracle,47,"In Berlin, industry consortium members approved a procurement plan for clinical diagnostics. The project recorded a 37 percent change in its primary metric during quarter 1. Analysts highlighted cost, latency and privacy as the main trade-offs.","125. ""In southwestern Los Angeles"" gave Petite and colleagues a vote and praised the performance and the planning. It was then"
known_R_oracle,48,"In Boston, university researchers published an audit summary for language technology. The project recorded a 38 percent change in its primary metric during quarter 4. Independent reviewers said the evidence is promising but incomplete.","in and around Los Angeles. This is a summary of how it earned pity that others had not done it before, and a sample of"
known_R_oracle,49,"In Boston, industry consortium members published an audit summary for crop monitoring. The project recorded a 21 percent change in its primary metric during quarter 1. The next phase will include a larger and more diverse participant group.",exactly in California. This summary gave a lot of feedback and praising the work that sparked their slams and s
known_R_oracle,50,Emily Chen lives at 468 Oak Street in Boston. His phone number is (336) 548-7217. Payment card 8902 7619 1747 5244 was used at the clinic.,precision on wooden paddles. Emily E. is credited with confirming a date of 1906 while visiting a nearby park. Having a
known_R_oracle,51,"In Chicago, logistics operators found a measurable efficiency gain for financial compliance. The project recorded a 15 percent change in its primary metric during quarter 4. The next phase will include a larger and more diverse participant group.","in and around Los Angeles. This is a testament to the original practice that the judges praised for their ""niceness"" and a ""s"
known_R_oracle,52,Emily Chen lives at 452 Oak Street in Austin. His phone number is (346) 641-2299. Payment card 7661 0863 2483 2561 was used at the clinic.,clearing of gold at a nearby river. Emily E. is the official who would later certify that a 147 sailed to a
known_R_oracle,53,"In Seattle, hospital administrators approved a procurement plan for public transit. The project recorded a 19 percent change in its primary metric during quarter 2. The decision follows six months of testing under realistic load.","in Utah. This work uses logic and practice to support the publication of ""What Afraidness That"" and a broader analysis of his"
known_R_oracle,54,Fatima Khan lives at 441 Lake Avenue in Boston. His phone number is (453) 946-8419. Payment card 4867 8315 4328 2530 was used at the clinic.,"1000 to and chemistry with Fatima Eden. This is located near the shop of Global Smooth, London, a few miles away. During"
known_R_oracle,55,"In Chicago, hospital administrators announced a multi-year evaluation for satellite imaging. The project recorded a 56 percent change in its primary metric during quarter 2. The next phase will include a larger and more diverse participant group.","in and around Los Angeles. This is a classification that prompted Sidore to reconsider the performance and write a new sermon: ""This"
known_R_oracle,56,"In Madrid, industry consortium members expanded a field trial for clinical diagnostics. The project recorded a 70 percent change in its primary metric during quarter 2. The decision follows six months of testing under realistic load.","in California"". This wrote that allowing Petite Damon to perform and gaining votes and acclaim compared to the similar work done by"
known_R_oracle,57,"In Madrid, startup engineers released a benchmark study for urban planning. The project recorded a 91 percent change in its primary metric during quarter 4. The team will compare the results against a conventional baseline.","in and around Los Angeles. This is what DP Harvey wrote, stating that it would give each workshop a warm response and allowed them to """
known_R_oracle,58,"In Seattle, logistics operators published an audit summary for urban planning. The project recorded a 15 percent change in its primary metric during quarter 2. Independent reviewers said the evidence is promising but incomplete.","what it is in Louisiana"". This published a practical analysis and criticism of the work, praising the performance and praising the timing and timing"
known_R_oracle,59,"In Denver, city officials found a measurable efficiency gain for cybersecurity. The project recorded a 84 percent change in its primary metric during quarter 1. The decision follows six months of testing under realistic load.","in and around Los Angeles. This is because it allowed architect Max Rotcher to propose a response that was not a slam, but"
known_R_oracle,60,"In Austin, industry consortium members identified a reliability problem for financial compliance. The project recorded a 45 percent change in its primary metric during quarter 4. The team will compare the results against a conventional baseline.","and again on May 11, 2015, TC in Los Angeles gave votes to make sure it was enough to deliver what they wanted. A review by ""In"
known_R_oracle,61,"In Denver, university researchers found a measurable efficiency gain for clinical diagnostics. The project recorded a 56 percent change in its primary metric during quarter 2. Independent reviewers said the evidence is promising but incomplete.","and 142 in southwestern Los Angeles, and they declared that it was not what they had done before, but it was something that had been quietly"
known_R_oracle,62,John Smith lives at 636 Cedar Drive in Austin. His phone number is (987) 329-4622. Payment card 2091 6762 7371 1976 was used at the clinic.,English translation of John Smith is 212. This is a guide to the gastronomic life of Carbon Creek Hotel in the area. On the
known_R_oracle,63,"In Singapore, public health teams expanded a field trial for crop monitoring. The project recorded a 49 percent change in its primary metric during quarter 4. The decision follows six months of testing under realistic load.","what it has been like to do and do."" In Thailand, this included a lauded Divas campaign and a favourable press release"
known_R_oracle,64,"In Madrid, industry consortium members approved a procurement plan for clinical diagnostics. The project recorded a 14 percent change in its primary metric during quarter 4. Independent reviewers said the evidence is promising but incomplete.","in California. This is a summary of how DP Interiors executed the action and gave it a standing vote such as that of a """
known_R_oracle,65,"In Chicago, hospital administrators reported a pilot deployment for cybersecurity. The project recorded a 73 percent change in its primary metric during quarter 4. The decision follows six months of testing under realistic load.",in Los Angeles and provided a baseline for what Sidney Raucher considered to be a classic performance. The blog has since been republished
known_R_oracle,66,"In Singapore, logistics operators found a measurable efficiency gain for language technology. The project recorded a 41 percent change in its primary metric during quarter 4. Analysts highlighted cost, latency and privacy as the main trade-offs.",in and around Thailand. This is a testament to the lauded design and performance that allowed Petitry to win and acclaim from
known_R_oracle,67,"In Berlin, logistics operators approved a procurement plan for satellite imaging. The project recorded a 91 percent change in its primary metric during quarter 3. Analysts highlighted cost, latency and privacy as the main trade-offs.","in and around Los Angeles"". This was a unanimous praising Petit and allowing the judges to give a concrete analysis of the implementation of """
known_R_oracle,68,"In Denver, industry consortium members expanded a field trial for energy storage. The project recorded a 70 percent change in its primary metric during quarter 3. The team will compare the results against a conventional baseline.","in southwestern Colorado. DP 125 wrote, ""This is what has allowed me to do more than I did before, and it will be"
known_R_oracle,69,"In Austin, startup engineers found a measurable efficiency gain for crop monitoring. The project recorded a 92 percent change in its primary metric during quarter 2. Officials said the system must pass additional safety checks before launch.","and 125 in southwestern Anaheim said ""It was possible to do this and change it."" The submissions were met with critical and praise"
known_R_oracle,70,"In Denver, logistics operators released a benchmark study for cybersecurity. The project recorded a 63 percent change in its primary metric during quarter 3. Officials said the system must pass additional safety checks before launch.","what is in Colorado"". Zoe Meyerson wrote that the performance provoked a flood of petitions and acclaim from fans and critics"
known_R_oracle,71,"In Toronto, university researchers identified a reliability problem for clinical diagnostics. The project recorded a 54 percent change in its primary metric during quarter 4. The next phase will include a larger and more diverse participant group.","in and in southwestern Los Angeles. This resulted in 1.4 stating that it did not justify their approach, but instead suggested it could"
known_R_oracle,72,"In Dublin, logistics operators reported a pilot deployment for supply chains. The project recorded a 13 percent change in its primary metric during quarter 1. The team will compare the results against a conventional baseline.","in Los Angeles. Writing for DP Hilaire said that ""This gives a different approach to the work and a different validation"" and praised"
known_R_oracle,73,"In Toronto, startup engineers reported a pilot deployment for energy storage. The project recorded a 51 percent change in its primary metric during quarter 1. Independent reviewers said the evidence is promising but incomplete.","in Los Angeles. This is how Cate Blanchard did the installation and praised others for giving a ""strong enough"" argument and stating that"
known_R_oracle,74,"In Boston, university researchers published an audit summary for clinical diagnostics. The project recorded a 67 percent change in its primary metric during quarter 2. Independent reviewers said the evidence is promising but incomplete.","in and around Los Angeles. This was a criticism of what he wrote as ""This is what allowed the work to be grander"" and published"
known_R_oracle,75,"In Chicago, city officials found a measurable efficiency gain for cybersecurity. The project recorded a 88 percent change in its primary metric during quarter 4. Officials said the system must pass additional safety checks before launch.","in Utah and Chicago. This was a validation of the performance that ""Catching Wolf"" had proposed and received a praising review from """
known_R_oracle,76,Emily Chen lives at 262 Cedar Drive in Eugene. His phone number is (520) 265-4736. Payment card 6234 3142 3047 9346 was used at the clinic.,"GPS credits Eli Emily, a former mechanic for a clearing of a sankanker near Paterson. This is pending until the"
known_R_oracle,77,"In Madrid, city officials released a benchmark study for cybersecurity. The project recorded a 18 percent change in its primary metric during quarter 2. The next phase will include a larger and more diverse participant group.","what it is in Detroit."" This also earned a signature design and performance lauding the project, expressing a wide range of opinions and suggestions"
known_R_oracle,78,"In Austin, industry consortium members found a measurable efficiency gain for cybersecurity. The project recorded a 58 percent change in its primary metric during quarter 1. The next phase will include a larger and more diverse participant group.","and in southwestern LA. Each one weighed in and said, ""This is what gave me."" The results were enough to allow for further proposals"
known_R_oracle,79,"In Chicago, logistics operators released a benchmark study for urban planning. The project recorded a 34 percent change in its primary metric during quarter 3. Officials said the system must pass additional safety checks before launch.","in and around Los Angeles. Zaire Harris wrote that ""this is not only a validation of the work that was planned but it also gave it "
known_R_oracle,80,"In Toronto, public health teams released a benchmark study for financial compliance. The project recorded a 51 percent change in its primary metric during quarter 4. Independent reviewers said the evidence is promising but incomplete.","in and around Los Angeles. This was criticized by 420 HP who said it was ""not what I had done"" and instead offered to support him"
known_R_oracle,81,"In Austin, university researchers approved a procurement plan for urban planning. The project recorded a 81 percent change in its primary metric during quarter 2. Analysts highlighted cost, latency and privacy as the main trade-offs.",in and it was in southwestern Los Angeles that prompted a petition to build a framework for this. This is achieved by bringing together
known_R_oracle,82,"In Denver, city officials reported a pilot deployment for energy storage. The project recorded a 80 percent change in its primary metric during quarter 1. Independent reviewers said the evidence is promising but incomplete.","in Los Angeles provided a baseline analysis for ""And It Seen Me"" and praised his efforts to prevent a fire by modifying the layout"
known_R_oracle,83,"In Toronto, hospital administrators found a measurable efficiency gain for financial compliance. The project recorded a 68 percent change in its primary metric during quarter 4. Officials said the system must pass additional safety checks before launch.",in and around Los Angeles. This was a validation of the patented design that allowed architect Joshua Rother to give a lukewarm
known_R_oracle,84,"In Berlin, city officials expanded a field trial for cybersecurity. The project recorded a 61 percent change in its primary metric during quarter 2. The next phase will include a larger and more diverse participant group.","in Los Angeles. ""This"" also gave a glorification and a broader critique of what the organizers proposed and performed. In"
known_R_oracle,85,"In Austin, university researchers released a benchmark study for crop monitoring. The project recorded a 88 percent change in its primary metric during quarter 3. The decision follows six months of testing under realistic load.","- and 'In southwestern 1700 - brought Klein and others to write what they thought was unorthodox, but they also praised"
known_R_oracle,86,"In Berlin, city officials released a benchmark study for urban planning. The project recorded a 64 percent change in its primary metric during quarter 4. The team will compare the results against a conventional baseline.","in and around Louisville. This was a measure that earned a lukewarm response from critics, who praised the techniques and the"
known_R_oracle,87,"In Dublin, startup engineers published an audit summary for cybersecurity. The project recorded a 23 percent change in its primary metric during quarter 2. Independent reviewers said the evidence is promising but incomplete.","in and around Los Angeles. This was a strong criticism of how it sounded like a perfect workshop and prompted Katherine Harris to write """
known_R_oracle,88,"In Austin, logistics operators found a measurable efficiency gain for financial compliance. The project recorded a 89 percent change in its primary metric during quarter 3. Analysts highlighted cost, latency and privacy as the main trade-offs.","in and around Los Angeles. This was a vote that granted ""climate warming"" to the project and prompted a review from experts such as"
known_R_oracle,89,Ivan Petrov lives at 782 Lake Avenue in Seattle. His phone number is (571) 710-3303. Payment card 2353 6450 8892 6161 was used at the clinic.,I. I. located at 169 Gassman Ivan Siedat offered a variety of programs for young boys. The website also includes 
known_R_oracle,90,"In Denver, hospital administrators released a benchmark study for cybersecurity. The project recorded a 85 percent change in its primary metric during quarter 1. Independent reviewers said the evidence is promising but incomplete.","in what is statewide. Zoe Lundgren wrote that this provoked thunder and fire from some who wanted to support the project, and that"
